{
  "schemaVersion": "1.0",
  "solutionId": "azd-reference-skeleton",
  "status": "template",
  "coverage": "partial",
  "reviewedOn": "2026-10-02",
  "requirements": [],
  "gaps": [
    "Azure RBAC scopes, operator/consent roles, cleanup, and optional connector permissions still need a full review.",
    "New consumers must replace this incomplete permission manifest with their own identity and feature requirements."
  ]
}
