{
  "schemaVersion": "1.0",
  "solutionId": "azd-reference-deployment-check",
  "status": "template",
  "coverage": "partial",
  "reviewedOn": "2026-10-02",
  "requirements": [],
  "gaps": [
    "Azure RBAC scopes, operator/consent roles, cleanup, and optional connector permissions still need a full review.",
    "Azure resource deployment, identity assignments and scoped validation requirements need manifest review."
  ]
}
